{
  "schema_version": 1,
  "status": "not_run",
  "client_version": null,
  "agent_id": null,
  "parent_agent_id": null,
  "depth": null,
  "requested_model": "gpt-5.6-luna",
  "requested_effort": "max",
  "observed_model": null,
  "observed_effort": null,
  "evidence_quality": "none",
  "native_parentage_verified": false,
  "may_spawn": null,
  "evidence_refs": []
}
